date,user_id,pp_text,tag,like_point
2019-06-08T14:51:42.000Z,seasnax,Chomperzstickyriceweekendvibessummereatssummersnackssaturdaysavoryfoodiecrunchyyumtastyfoodieseaweedchipsseaweedcrispsseasnaxveganplantbasedglutenfreehealthyishwellness,#Chomperz #stickyrice #weekendvibes #summereats #summersnacks #saturday #savory #foodie #crunchy #yum #tasty #foodie #seaweedchips #seaweedcrisps #seasnax #vegan #plantbased #glutenfree #healthyish #wellness,0
2019-06-08T14:51:42.000Z,woon.heng,Oooh Chomperz on,,1
2019-06-08T14:51:42.000Z,cavemanfoods,A much better version of Funyuns,,0
2019-06-08T14:51:42.000Z,hollys_bestlife,These are the best,,0
2017-03-31T06:50:04.000Z,just4you_korea,Bibigo Seaweed CrispsBBQcodes120HKD2520g4 15whatsapp6601 0311 9029 9705mtr gmarket auctionigshophkighongkongonlinestorejust4you koreaemartbibigoseaweedcrisps,#igshop #hkig #hongkongonlinestore #just4youkorea #emart #bibigo #seaweedcrisps,10
2015-10-02T04:49:02.000Z,chicmeal,chicmealcrunchythaicookiescaramelizedcrispscheesycrispsseaweedcrispsspicycrispsthaidessertdessertyummyinstagoodinstafooddelicioushomemadephotoofthedayfoodstagramfoodphotographyfoodpicoftheday,#crunchythaicookies #caramelizedcrisps #cheesycrisps #seaweedcrisps #spicycrisps #thaidessert #dessert #yummy #instagood #instafood #delicious #homemade #photooftheday #foodstagram #foodphotography #foodpicoftheday,10
2020-01-13T09:41:37.000Z,lovebellbelle,Seaweed crunchfirst batch doneHaven t fry it in oil for yearshad been using air fryer for it and it didn t taste goodback to frying with oil foodbloggerfoodiefooddiarycnytidbitscnycomingseaweedcrunchseaweedcrispsseaweedtwisttidbitslunarnewyear2020cny2020,#foodie #fooddiary #cnytidbits #cnycoming #seaweedcrunch #seaweedcrisps #seaweedtwist #tidbits #lunarnewyear2020 #cny2020,20
2019-08-22T11:13:41.000Z,seaflavours.nl,Het is vegan donderdagTijd voor het Sea Man MenuWeinig vetveel plantaardige eiwittenEet je meemadfar dkseamanchips veganfood vegansnackswestcoastseasalt noplasticintheoceans seaweedcrisps zeewier seaweed makefoodgoodagain,#seamanchipsveganfoodvegansnacks #westcoastseasaltnoplasticintheoceansseaweedcrispszeewierseaweedmakefoodgoodagain,19
2014-05-19T02:37:41.000Z,house_of_leaves88,seaweedsnaksseaweedcrispsbakedseaweedseaweedsaltedsesameasiangood,#seaweedsnaks #seaweedcrisps #bakedseaweed #seaweed #salted #sesame #asian #good,12
2019-08-19T15:51:11.000Z,find.brazil,Exportaes de min rio de ferro do Brasil cresceram 16 6em julho ante o m s anteriorpara 34 3 milh es de toneladas FindBrazilComercioExternoExportInternationalBusinessEntrepreneurbussinesscleanoceanshealthysnacksnoplasticintheoceanseaweedtrangtiltangseamanseaweedchipsseamanchipssuperfoodtangchipsseaweedcrispsgrenaaentrepreneurfirstneverfollowsexportbusinesstradetraveltransformmotivationentrepreneurmindssuccessfulmindsmindsetmentormoneymindsetmotivationfridaysuccessdiariesquotesoflife,#ComercioExterno #Export #InternationalBusiness #Entrepreneur #bussiness #cleanoceans #healthysnacks #noplasticintheocean #seaweed #trangtiltang #seamanseaweedchips #seamanchips #superfood #tangchips #seaweedcrisps #grenaa #entrepreneur #firstneverfollows #exportbusiness #tradetraveltransform #motivation #entrepreneurminds #successfulminds #mindsetmentor #moneymindset #motivationfriday #successdiaries #quotesoflife,8
2018-06-25T13:05:09.000Z,emporiocentralboituva,Olha a novidade que chegou no Emp rio CentralLevescrocantes e saborososAssim s o os snacks de am ndoa e ab boraambos com gergelimda KalassiVisite nossa loja e leve o seu emp riocentralboituvaseaweedcrispssnackkalassiboituvatiet iper tatu cerquilho,#empriocentralboituva #seaweedcrisps #snack #kalassi #boituva #tiet #iper #tatu #cerquilho,10
2018-06-25T13:05:09.000Z,gabimatricardi,Meu deus eu quero,,0
2020-08-12T12:23:41.000Z,jojustlovetoeat,Miss JB so much till order our favourite snack online jojustlovetoeatseaweedcrispsblacksesameseaweedcrisps,#seaweedcrisps #blacksesameseaweedcrisps,3
2018-10-28T19:42:47.000Z,kristenarchervo,These are so goodSeaweed is delicious ya ll seaweedsnacksanniechunsseaweedcrispsorganicsnackshealthysnackhealthyfoodcleaneating,#seaweedsnacks #anniechuns #seaweedcrisps #organicsnacks #healthysnack #healthyfood #cleaneating,17
2020-01-09T18:06:26.000Z,food_memos,Cheeky snack for the commute home from PaddingtonPopped into Wasabi to see what I could get for under two quid and these babies were the winnerSo moorishI think I have started an addiction that I might have to frequentwasabiseaweedseaweedcrispstempurasnacksnackagetrainsnacksjapanesefoodfood memos,#wasabi #seaweed #seaweedcrisps #tempura #snack #snackage #trainsnacks #japanesefood #foodmemos,5
2018-05-19T08:53:34.000Z,hungrybhav,New restaurant opening week forbucketlondon Beautifully decorated and very warm welcome Food was very enjoyable as was the view from our seat next to the kitchen watching the chefs rushing round filling ordersbloodymaryshot was boozy and savoury great start to the meal cocklesandchorizo nibble full of flavour tunatartare withseaweedcrispsavomayobreakfastradish lobsterandprawntoastie not my fave frittomistobucket bucketmussels deliciousness,#seaweedcrisps #avomayo #breakfastradishlobsterandprawntoastie,6
2018-05-19T08:53:34.000Z,bucketlondon,hungrybhav Thanks so much for coming in and the kind wordsHope to see you again soon,,1
2015-07-13T09:45:55.000Z,brillance0101,cj bibigoseaweedcrispskoreangourmetsnack snackinstafood,#cj #bibigo #seaweedcrisps #koreangourmetsnacksnack #instafood,12
2019-10-15T11:12:26.000Z,seamanchips,Smileyour on camera pirateSeaManTruck SeaManSeaweedChips SeaManSushi NoPlasticInTheOceans VerdensbedsteThomas SeaManChips SeaweedCrisps TrangTilTang,,37
2019-10-14T19:31:44.000Z,seamanchips,Get the picture seamanchips nlSeaMan4thewin NoPlasticInTheOceans SeaManChips TrangTilTang SeaManSeaweedChips SeaweedCrisps,#SeaMan4thewinNoPlasticInTheOceansSeaManChipsTrangTilTangSeaManSeaweedChipsSeaweedCrisps,33
2019-10-14T19:31:44.000Z,seamanchips_nl,Maybe we should give a hintit is in the Rijksmuseum in Amsterdam,,1
2019-03-11T09:42:25.000Z,seamanchips,The team against plastic pollution SEAMAN is donating 10of the profit to Plastic ChangeCheck our website if you want to support Plastic Changes through merchandisenoplasticintheoceanhjemhavn plasticchangetangchipsseaweedcrispshighproteincleanocean,#hjemhavnplasticchange #tangchips #seaweedcrisps #highprotein #cleanocean,33
2016-02-26T21:30:52.000Z,imagine_live_adventure,Thai Spiced Sea Bassthaifoodseabassfreshfishgingerpineapplefusionflavoursspicingitupseaweedseaweedcrisps,#thaifood #seabass #freshfish #gingerpineapple #fusionflavours #spicingitup #seaweed #seaweedcrisps,9
2018-11-28T04:45:20.000Z,otenekoamerinko,20 SEAWEEDCRISPS,,46
2018-03-10T08:00:16.000Z,seaweedcrispymurah2,Assalamualaikum dan selamat petang kekadang anda ingin mengisi perut anda dengan kerepek2 yg ranggup dan sedap boleh lah anda cuba rasa seaweed crispy yg pasti ranggup dan sedap boleh makan bila2 masa sahajadengan harga yg murahSekarang saya mengambil pre order untuk sesiapa yg ingin rasa seaweed crispy ini dan dalam dua minggustock baru sampai Seaweed crispy ini juga juga boleh dimakan oleh semua orang Anda beli 1 pasti akan mahu lagi marikawan2 try rasa seaweed crispy yg sedapseaweed ini cukup rasa dengan masinnye dan rumpai laut ituseaweedcrispsseaweedcrispymurah2 seaweedcrispysedapppp Cod Area bangi dan taman tuanku jaafar tiada cas dikenakanpostage pun ade dengan cas harga postage yg terkini,#seaweedcrispymurah2seaweedcrispysedapppp,15
2019-10-06T11:05:29.000Z,abakusfoods,Give your Sunday lunch a healthy twist with Seaweed CrispsWhy not try topping a sushi bowl with our Seaweed Crisps likeieva eatshead over to her page to check out the recipesundaysundaylunchveganlunchveganfoodsharesushibowlvegannaturalseaweedseaweedcrispsfreefrom,#sundaylunch #veganlunch #veganfoodshare #sushibowl #vegan #natural #seaweed #seaweedcrisps #freefrom,74
2019-10-06T11:05:29.000Z,abakusfoods,vegansundaylunchhealthylunchkoreanfoodasianfoodeattherainboweatwelllivewellvegansofigcleaneatingwholefoodsplantbasedplantpoweredhealthyfoodpornthefeedfeedveganfeedfeedveganfoodlovers,#vegansundaylunch #healthylunch #koreanfood #asianfood #eattherainbow #eatwelllivewell #vegansofig #cleaneating #wholefoods #plantbased #plantpowered #healthyfoodporn #thefeedfeed #veganfeedfeed #veganfoodlovers,1
2019-07-10T14:30:28.000Z,find.brazil,Am rica Latina aumentarsua cota de exportao de alimentos at25em 2028FindBrazilComercioExternoExportInternationalBusinessEntrepreneurbussinesscleanoceanshealthysnacksnoplasticintheoceanseaweedtrangtiltangseamanseaweedchipsseamanchipssuperfoodtangchipsseaweedcrispsgrenaaentrepreneurfirstneverfollowsexportbusinesstradetraveltransformmotivationentrepreneurmindssuccessfulmindsmindsetmentormoneymindsetmotivationfridaysuccessdiariesquotesoflife,#ComercioExterno #Export #InternationalBusiness #Entrepreneur #bussiness #cleanoceans #healthysnacks #noplasticintheocean #seaweed #trangtiltang #seamanseaweedchips #seamanchips #superfood #tangchips #seaweedcrisps #grenaa #entrepreneur #firstneverfollows #exportbusiness #tradetraveltransform #motivation #entrepreneurminds #successfulminds #mindsetmentor #moneymindset #motivationfriday #successdiaries #quotesoflife,7
2016-09-02T07:25:48.000Z,the_som_korea,KoreaCJBibigo Seaweed CrispsCJsnacks official site link http m cj co kr cjm kr products The SOM Korea website www facebook com thesomkorBEAUTYlink https goo gl 4YpkNk FASHIONlink https goo gl NMjslZ FOOTlink http goo gl 0Yb5B0 F Blink http goo gl Ztj2dv Starbuckslink https goo gl F7k0bs OTHERSlink https goo gl cwYjKt ig igshop korea kr seoul agency buyer lifestyle cj seaweed crisps seaweedcrisps bibigo snacks food diet rice lotd delicious yummy wholesale worldwide,,28
2016-08-08T15:00:08.000Z,randomramblinghan,These are so weird but so moreish LBT was different todaywe did it in a circuit type workoutwith equipment as well as body weight exercisesand it was a fun but a bit challengingwhich felt so good afterwards and Step Aerobics was awesome as usualfoodfoodiehealthyhealthyfoodvegetarianvegetarianfoodveganveganfoodsnackhealthysnacklowcarblowfatfibrewholefoodsnaturalplantbasedhealthycrispsseaweednoriJapaneseseaweedcrispscrispscrunchymoreishweirdfoodedfamfitfamactivelifestylepostworkout,#food #foodie #healthy #healthyfood #vegetarian #vegetarianfood #vegan #veganfood #snack #healthysnack #lowcarb #lowfat #fibre #wholefoods #natural #plantbased #healthycrisps #seaweed #nori #Japanese #seaweedcrisps #crisps #crunchy #moreish #weirdfood #edfam #fitfam #activelifestyle #postworkout,40
2016-08-08T15:00:08.000Z,strength_in_perseverance,I got something similar the other day from Whole Foods and they were not too pleasantThey smelt really dodgy and it was really off puttingglad you enjoyed yoursLove step aerobicsSounds like you re having a fun day xxxx,,0
2020-01-26T13:12:55.000Z,roadwafflenomz,Honey butter seaweed rice crispsThese were surprisingly deliciousseaweedcrispsseaweedricecrispshoneybutterv i,#seaweedricecrisps #honey #butter #vi,64
2020-01-26T13:12:55.000Z,sebrenasmiles,Where d you get them,,0
2019-07-12T20:29:49.000Z,seamanchips,Snacks to the inner pirate seamanchipsnoplasticintheoceansseamanseaweedchipsseaweedcrispstrangtiltang,#seamanchips #noplasticintheoceans #seamanseaweedchips #seaweedcrisps #trangtiltang,160
2019-07-12T20:29:49.000Z,swingboing,Looks great guys,,1
2019-06-15T19:56:57.000Z,chifaichip,Bibim Men with seaweed fromhibs healthinblackbibimmenpaldokoreannoodlescoldnoodlesnoodlesseaweedsnacksseaweedseaweedcrispsseaweedlavercrispsfoodnycfoodnycfoodiefoodaddictfoodstylingfoodsfoodbloggerfoodiesfoodloversfoodheavenfoodphotographyfoodographyfoodofthedayfoodpicsfoodstagramfoodblogfoodbeastinstafooddeliciousyummynomnom,#paldo #koreannoodles #coldnoodles #noodles #seaweedsnacks #seaweed #seaweedcrisps #seaweedlavercrisps #food #nycfood #nycfoodie #foodaddict #foodstyling #foods #foodblogger #foodies #foodlovers #foodheaven #foodphotography #foodography #foodoftheday #foodpics #foodstagram #foodblog #foodbeast #instafood #delicious #yummy #nomnom,43
2019-06-15T19:56:57.000Z,eatthegoodstuffs,WonderfulI d like to see more like this,,1
2019-06-15T19:56:57.000Z,pennyip_studio,Stunning,,1
2019-10-15T05:26:32.000Z,heinemax,Dagen derndrede alt i min tangkiosk Sol Over Gudhjem COOPtakdavidberingSeaManSeaweeChips NoPlasticInTheOceans SeaManChips TrangTilTang SeaweedCrisps,#SeaManSeaweeChipsNoPlasticInTheOceansSeaManChipsTrangTilTangSeaweedCrisps,81
2019-10-15T05:26:32.000Z,tangstationen,Maxog sen masse ild,,1
2019-10-15T05:26:32.000Z,swingboing,One man army,,0
2018-09-29T20:21:21.000Z,snackstestet,Wow dom h r var speciellaPett bra s ttOerh rt krispiga med en genuin och fin havssmakDet n rmaste jagtit tidigarer japanska algchips men de h r chipsenk ndes nyttigareoch dessutom mer n rproducerade Goda som demr och skulle troligenven passa mycket bra ihop med n gon slags dipp typ hoummusajvar relish och eller vitl ksdippOm jag fick v lja shade jag kanske haft LITE mindre salt pdemmen detr inget som st r smakupplevelsen n mnv rt egentligenDenna varianten West Coast Sea Saltr veganmedan de andra tvvarianterna inneh ller animalieroch jag rekommenderar dem varmtStort tack tillseamanchips f r leveransen Betyg9 av 10 Snackstestet2018SnackstestetChipstestSnacksChipsCrispsSnackingSj gr sT ngAlgerFucusVesiculosusSpirulinaSj gr schipsSeaweedChipsSeaweedSnacksSeaweedCrispsWestcoastSeasaltSeamanSeamanChipsSeafoodSeaweedAlgeSnackstest2018,#Snackstestet2018 #Snackstestet #Chipstest #Snacks #Chips #Crisps #Snacking #Sjgrs #Tng #Alger #FucusVesiculosus #Spirulina #Sjgrschips #SeaweedChips #SeaweedSnacks #SeaweedCrisps #Westcoast #Seasalt #Seaman #SeamanChips #Seafood #Seaweed #Alge #Snackstest #2018,45
2018-09-29T20:21:21.000Z,snackstestet,TipsDessa borde ni k pa in och ha i erat sortimentluckansfiskroiivar,,2
2018-09-29T20:21:21.000Z,kristoffersv,BetygVerkar ju awesome,,1
2018-09-29T20:21:21.000Z,ohmygim,Try ours too soon,,1
2018-09-21T10:54:44.000Z,japankoreamarket.id,Bibigo Seaweed Crips 20gr Price IDR 72 000,,56
2018-09-21T10:54:44.000Z,japankoreamarket.id,seaweedcrispsmakanankoreahalalmakanankoreajasatitipkoreaselatansnackkoreabibigo,#seaweedcrisps #makanankoreahalal #makanankorea #jasatitipkoreaselatan #snackkorea #bibigo,0
2018-04-08T19:37:33.000Z,angelfxybaby,sundayafternoonsnacksseaweedcrispsinstafoodtasty,#sundayafternoonsnacks #seaweedcrisps #instafood #tasty,6
2017-03-28T14:06:05.000Z,mahliandari,Yumm snackseaweedseaweedchipsseaweedcrispskoreanfoodkoreansnackfoodfoodieyumm,#snack #seaweed #seaweedchips #seaweedcrisps #koreanfood #koreansnack #food #foodie #yumm,29
2019-06-08T05:21:33.000Z,lily_grocery,groceryhaulbananastrawberryavocadoseaweedcrisps ribeyepoke seaweedsnack Bibigo ricespindrift kirklandalesandlagers costco 141 77,#groceryhaul #bananastrawberryavocadoseaweedcrispsribeyepokeseaweedsnackBibigo #alesandlagers,8
2016-09-08T20:54:50.000Z,foodiesince88,Perhaps saying goodbye to the Scottish Summer this weekso it s only right to sample the Spring Summer menu for the last time atno 10 aberdeenA mixture of my two favourite thingsMac and Cheese topped with Langoustinesmacandcheeselangoustinesseaweedcrispspinotgrigiosummermenudineoutaberdeenaberdeenfoodbloggerfoodbloggerfoodiescottishbloggerscotlandaberdeenfoodiesince88,#langoustines #seaweedcrisps #pinotgrigio #summer #menu #dineoutaberdeen #aberdeenfood #blogger #foodblogger #foodie #scottishblogger #scotland #aberdeen #foodiesince88,32
2020-07-09T21:58:41.000Z,tinebluff,Homemadeseaweedcrispssunsetdenmark,#seaweedcrisps #sunset #denmark,25
2020-07-09T21:58:41.000Z,tinebluff,mikalaphiliplarschristianbjerg,,1
2020-07-09T21:58:41.000Z,larschristianbjerg,Glad for jeg overgav migsmagte sgodt,,1
2020-07-09T21:58:41.000Z,mikalaphilip,Sdejlig tang og jer,,1
2020-07-09T21:58:41.000Z,bjarnesundby,Bl ret,,1
2019-10-18T14:09:45.000Z,seamanchips,HARBOR BOYSREADY TO ROCK Michael SvenningsenSeaManSeaweedChips NoPlasticInTheOcean SeaweedCrisps TrangTilTang SeaManChipsGrenaa,#SeaManSeaweedChipsNoPlasticInTheOceanSeaweedCrispsTrangTilTangSeaManChips #Grenaa,61
2019-10-12T09:57:53.000Z,n.ying.y,SiChuan Mala Seaweed Crisps fromsignaturemarket Chateau Jaron Bordeaux while catching up on Zhao Yao,,11
2019-10-12T09:57:53.000Z,ru_is_me,Is it nice the crisps,,1
2019-10-12T09:57:53.000Z,n.ying.y,foodshotgourmetsnackshandinframeigersmalaysiamultiphotosmultiphotosinstagramnofilteronthetableredwineseaweedcrispssichuanmalasichuanmalaseaweedcrispssignaturemarketwhati8today,#foodshot #gourmetsnacks #handinframe #igersmalaysia #multiphotos #multiphotosinstagram #nofilter #onthetable #redwine #seaweedcrisps #sichuanmala #sichuanmalaseaweedcrisps #signaturemarket #whati8today,0
2019-04-03T19:56:58.000Z,seamanchips,Special deliveryseamanchipstangchipsseamanseaweedchipssuperfood noplasticintheoceancleanoceantrangtiltangalgen seaweedcrispsentrepreneur,#tangchips #seamanseaweedchips #superfoodnoplasticintheocean #cleanocean #trangtiltang #algenseaweedcrisps #entrepreneur,56
2017-11-05T05:15:11.000Z,pjroxane,150 bibigoseaweedcrispsyogurtalmond,#bibigo #seaweedcrisps #yogurtalmond,15
2019-10-05T19:28:50.000Z,cristinacho,Who doesn t love a good seaweed snackseaweedcrispsKoreanSnacksDontKnockItUntilYouTryIt,#seaweedcrisps #KoreanSnacks #DontKnockItUntilYouTryIt,11
2019-10-05T19:28:50.000Z,abook_and_sometea,Some are quite yumWhat is the 3rd flavourSpicyBBQ and,,2
2019-10-05T19:28:50.000Z,mickey.v.vk,Yummy,,1
2018-03-01T16:04:43.000Z,mavegetable,Je viens de d couvrir une petite tuerie cor enneseaweedcrispsalguesrizsnacksyummyvegan,#seaweedcrisps #algues #riz #snacks #yummy #vegan,36
2018-03-01T16:04:43.000Z,gwenaelle200994,Il y en a icij ai h siten acheterc est vraiment bon,,0
2019-11-27T15:57:16.000Z,abakusfoods,8K followersjust want to say thank you to everyone who follows us and our healthy snacks movement 8kstartupveganglutenfreenaturalwednesdaywednesdaywisdomnaturalwholefoodsreddatesseaweedcrispsjujubeeatwelllivewell,#startup #vegan #glutenfree #natural #wednesday #wednesdaywisdom #natural #wholefoods #reddates #seaweedcrisps #jujube #eatwelllivewell,82
2019-11-27T15:57:16.000Z,abakusfoods,livelaughloveeattherainbowwhatveganseatvegansofigappreciationvegancommunityveganbrandsplantpoweredveganfoodsharefemaleentreprenuerlowcaloriehealthylifebalancedlife,#livelaughlove #eattherainbow #whatveganseat #vegansofig #appreciation #vegancommunity #veganbrands #plantpowered #veganfoodshare #femaleentreprenuer #lowcalorie #healthylife #balancedlife,0
2019-11-27T15:57:16.000Z,laurie_cooks_vegan,YayCongratulationsIt s because you are amazing x,,1
2019-11-27T15:57:16.000Z,the.veginner,Congratulations,,3
2019-11-27T15:57:16.000Z,gluten_freegb8,Oh wow these look sooooo goodCongrats on hitting 8K,,2
2019-11-27T15:57:16.000Z,thrivemagazine,these sound delicious,,0
2019-09-03T17:58:07.000Z,abakusfoods,Annnnnd they re live on our website want to give them a tryShop our Seaweed Crisps with a real crunch herehttps www abakusfoods com collections seaweed crispsseaweedcrispshighinfibreglutenfreevegansourceofiodineiodinenaturalwholefoodskoreansnacksseaweedseaweedsnackseaweedcrispstapioca,#seaweedcrisps #highinfibre #glutenfree #vegan #sourceofiodine #iodine #natural #wholefoods #koreansnacks #seaweed #seaweedsnack #seaweedcrisps #tapioca,46
2019-09-03T17:58:07.000Z,abakusfoods,vegansnackshealthysnackseattherainboweattheworldglutenfreesnacksveganinsposeaweedvegancheesecrispsgivingbackslimmingworldenvironmentalcausesnewlaunchcleaneatingeatwelllivewellfreefromnaturalfoodnourishyourbody,#vegansnacks #healthysnacks #eattherainbow #eattheworld #glutenfreesnacks #veganinspo #seaweed #vegancheese #crisps #givingback #slimmingworld #environmentalcauses #newlaunch #cleaneating #eatwelllivewell #freefrom #naturalfood #nourishyourbody,0
2019-09-03T17:58:07.000Z,lizzieellis_,Can t wait to grab mine,,1
2019-09-03T17:58:07.000Z,eshacks,Sounds yummy,,1
2019-09-03T17:58:07.000Z,glutenless_paige,I love seaweed so so much,,0
2019-09-03T17:58:07.000Z,amyandfreddie,I m really intrigued by theseI ve never seen seaweed crisps before,,0
2018-03-09T09:15:32.000Z,aliceboon,Friday begins with beer snacks bibigoseaweedcrispsbeerfridaycheers,#seaweedcrisps #beer #friday #cheers,23
2019-02-12T05:06:28.000Z,opom_korea,3 242 opomkoreaseoulkoreanfoodlottemartbibigoseaweedcrispssnacks,#korea #seoul #koreanfood #lottemart #bibigo #seaweedcrisps #snacks,18
2015-03-11T03:41:42.000Z,sakilabdulkhalid,Assalammualaikum semua Jom dapatkan seaweed crisps dgn harga less n terbaikkkk rasanya diministryofshopaholic rm11 je sebalang sepanjang bulan mac 2015 jom tengahari ni singgah ye katmoshputrajaya Xoxomoshputrajayaputrajayacyberjayabangivendorconceptseaweedcrispsbazaronlinebestvendor,#moshputrajaya #putrajaya #cyberjaya #bangi #vendorconcept #seaweedcrisps #bazaronline #bestvendor,5
2015-03-11T03:41:42.000Z,sanaprint.my,love it,,0
2020-08-04T01:19:07.000Z,_uk_to_hk,2 8 20 The firstmealin our new flatquarantinequarantinelifehongkongseaweedcrisps,#quarantinelife #hongkong #seaweedcrisps,0
2015-03-15T16:52:00.000Z,sastasnacks,sastasnacksbusydayseaweedfishingboatboattripseaweedcrispsfreshaircountryside,#sastasnacks #busyday #seaweed #fishing #boat #boattrip #seaweedcrisps #freshair #countryside,14
2017-03-05T03:55:42.000Z,pjroxane,bibigoseaweedcheiljedang seaweedcrisps,#bibigo #seaweed #cheiljedang #seaweedcrisps,11
2019-10-04T17:00:30.000Z,anniechunsinc,Gluten freeorganicand delicious right in the middle of CostcoPick up a bagor two of sea salt seaweed crisps today,,84
2019-10-04T17:00:30.000Z,anniechunsinc,seaweedseaweedcrispsseaweedsnackshealthysnackscostcoafterschoolsnackvegansnacksglutenfreesnacksorganicsnacks,#seaweedcrisps #seaweedsnacks #healthysnacks #costco #afterschoolsnack #vegansnacks #glutenfreesnacks #organicsnacks,0
2019-10-04T17:00:30.000Z,melloyello77,My Costco never has them anymore,,0
2019-10-04T17:00:30.000Z,lasa3,cupshope our costco has it,,0
2019-10-04T17:00:30.000Z,foodieyaya,Omg I ve been trying to get my hands on thisBut I couldn t find it at Costco,,0
2019-10-04T17:00:30.000Z,pickles_the_bassethound,I asked for assistance in finding them at Costcoon the East Coast and was told they don t carry them anymoreThat s too badthey are yummy,,0
2019-10-04T17:00:30.000Z,seoz.14,Oh yeah yeah,,0
2019-10-04T17:00:30.000Z,meech.briks,Is this available at every CostcoI haven t been able to find it at mine,,0
2019-10-04T17:00:30.000Z,marina.ldwn,Can t find them anywherenot at local Target or Walmart eitherEast Coast,,0
2016-04-22T22:21:24.000Z,macca0075,I ve had that crunchie feeling all day as it s Fridaytfifipatimecircadianseaweedcrispsposhsnacks ringwoodbreweryitsu,#tfif #ipatime #circadian #seaweedcrisps #poshsnacksringwoodbrewery,4
2019-05-24T08:49:00.000Z,seamanchips,OHEY The Squid Pepper is in the finals ofCoop Produktprisen 2019 Sol over Gudhjemthe finals will take place on Bornholm 22th of June SeaMan is happy and Captain Hooksolovergudhjem trangtiltangseamanseaweedchipsalgenchipsentrepreneurshipcleanoceansnoplasticintheoceans t ngseaweed singleusesuckshealthysnackssuperfood Grenaa b redygtighedenshusdenmark localfood sustainablet ng tangchips seaweedcrisps kologibio organic squidpepper,#solovergudhjemtrangtiltang #seamanseaweedchips #algenchips #entrepreneurship #cleanoceans #noplasticintheoceanstng #seaweedsingleusesucks #healthysnacks #superfoodGrenaabredygtighedenshus #denmarklocalfoodsustainable #tngtangchipsseaweedcrisps #kologi #bioorganicsquidpepper,173
2019-05-24T08:49:00.000Z,tangstationen,Tillykke Max,,1
2019-05-24T08:49:00.000Z,6_feet_over_kitchen,Min yndling,,0
2019-05-24T08:49:00.000Z,food2smilenl,Amazing,,1
2019-05-24T08:49:00.000Z,princessadiary,Now that s a keen eye for art and fashionI think you d do pretty well atpincstyle follow usWhy not register an account today at http www pincstyle com signup and start earning cash every time you post content,,0
2020-02-17T04:09:16.000Z,hofu_japanese_snacks,New addition to our HOFU familyIf you are a fan of mala and hotpotthis is a must try snackshofuhofujapanesesnackssnacksseaweedcrispstofucrisps,#hofujapanesesnacks #snacks #seaweedcrisps #tofucrisps,7
2016-09-29T10:24:15.000Z,kulau,Prelaunchthe moment has finally arrivedyou can preorder our organic seaweed crisps now in our Onlineshop at kulau deseaweedcrispsEs ist endlich soweitihr k nnt unsere neuen Bio AlgenchipsHOT GINGERjetzt im Onlineshop vorbestellenkulau de sea veggies KULAUbioseaveggiesorganicbioalgenalgenmeeresalgenseaweedorganicseaweedtrockenalgenveganmeeresgem sealgueshealthyhealthyfoodveganfoodwakamebiowakameseaweedflakessealettuceflakesmeeressalatflockenalgenflockenalgenchipsseaweedcrispscrispsorganiccrispsbiochipsbioalgenchipsbiosnackorganicseaweedcrisps,#seaweedcrispsEs #bio #seaveggies #organic #bioalgen #algen #meeresalgen #seaweed #organicseaweed #trockenalgen #vegan #meeresgemse #algues #healthy #healthyfood #veganfood #wakame #biowakame #seaweedflakes #sealettuceflakes #meeressalatflocken #algenflocken #algenchips #seaweedcrisps #crisps #organiccrisps #biochips #bioalgenchips #biosnack #organicseaweedcrisps,38
2016-05-21T13:15:49.000Z,chicmeal,chicmealcaramelizedcrispscheesycrispsseaweedcrispsspicycrispsthaidessertdessertyummyinstagoodinstafooddelicioushomemadephotoofthedayfoodstagramfoodphotographyfoodpicoftheday,#caramelizedcrisps #cheesycrisps #seaweedcrisps #spicycrisps #thaidessert #dessert #yummy #instagood #instafood #delicious #homemade #photooftheday #foodstagram #foodphotography #foodpicoftheday,7
2016-07-07T18:20:05.000Z,thedukandiet,Looking for a Dukan friendly portable snackTry seaweed crispsGreat for PV days,,135
