date,user_id,pp_text,tag,like_point
2017-12-05T13:51:27.000Z,ketouk123,Quickeasy keto friendly snack ketohealthysnacksseaweedcrisps,#keto #healthysnacks #seaweedcrisps,12
2016-06-22T04:12:57.000Z,seapointfarms,travelessentials Be comfortable practical preparedPreparation is key when traveling so keep thehealthysnacks and docs readily available to get through TSA seamlesslyseaweedcrispsglutenfreevegan,#travelessentials #healthysnacks #seaweedcrisps #glutenfree #vegan,52
2016-06-22T04:12:57.000Z,seapointfarms,nongmopassportwanderlusttuesdayseaweednorienjoylifeeatwellalmondsesamesuperfoodwhatveganseatplantbasedhealthyjunesummersummer16,#nongmo #passport #wanderlust #tuesday #seaweed #nori #enjoylifeeatwell #almond #sesame #superfood #whatveganseat #plantbased #healthy #june #summer #summer16,0
2016-06-22T04:12:57.000Z,seapointfarms,bananaleafleafprintpillowtraveleatfoodmagazinearchitecturaldigest,#bananaleaf #leafprint #pillow #travel #eat #food #magazine #architecturaldigest,0
2016-06-22T04:12:57.000Z,buppaacrof,BOOM,,0
2016-06-22T04:12:57.000Z,seapointfarms,superfoodsaydeez loving the lifestyle vibe,,0
2016-06-22T04:12:57.000Z,seapointfarms,forcaapplaurelattanasio,,0
2016-06-22T04:12:57.000Z,jeckstein57,Ready for some snacks and travel 2 weeks,,0
2016-06-22T04:12:57.000Z,seapointfarms,Fantastic plan for the top of summer jeckstein57,,0
2017-04-20T09:50:06.000Z,vegan_cooker,Diese leckeren Reis Algen ChipsSEAWEED CRISPS habe ich beim einkaufen in Frankreich gefundenDiese sindGlutenfrei BIO und nat rlich VEGAN seaweedcrispsbiohealthhealthygesundessenveganfranceGlutenfreisansglutenveganoveganskvegetarianofrancebibigochipsdalguesbretagnevegantravelersveganfoodhealthyfoodvegFOODsnackchipsderizauxalguessaveuroriginalevegansnack,#bio #health #healthy #gesundessen #veganfrance #Glutenfrei #sansgluten #vegano #vegansk #vegetariano #france #bibigo #chipsdalgues #bretagne #vegantravelers #veganfood #healthyfood #veg #FOOD #snack #chipsderizauxalguessaveuroriginale #vegansnack,55
2015-11-11T20:04:26.000Z,rmestes1,These are addictingI think these will do nicely to replacenormalchips for me when I crave that crunch befitbehealthybehappyhealthylifemomlifelikeabosswomenmenwholefoodsbeachbodycoachyummyseaweedcrispsdeliciousenjoyyourfoodeatgreathealthychoicesputdownthechips,#befit #behealthy #behappy #healthylife #momlife #likeaboss #women #men #beachbodycoach #yummy #seaweedcrisps #delicious #enjoyyourfood #eatgreat #healthychoices #putdownthechips,11
2015-11-11T20:04:26.000Z,matt_dillingham,Aww cool,,0
2015-11-11T20:04:26.000Z,_phlabs,Tag us in yourhealthy lifestylepics and you could get featured on our account,,0
2020-02-23T13:55:15.000Z,snackinglove,SOOOO delicious These have a thin layer of crisp tapiocaGame changer for seaweed crisps,,2
2020-02-23T13:55:15.000Z,snackinglove,seaweedcrispsabakusfoodsseaweedhealthysnack,#seaweedcrisps #abakusfoods #seaweed #healthysnack,0
2018-03-21T21:56:07.000Z,kalay.11,cevichesohoperuvianfoodscalloptiraditobloodorangerocototigersmilkmeltinthemouthwangweioctopusmisomarinatechancacahoneyseaweedcrispssweetpotatopureecevichewednesday,#ceviche #soho #peruvianfood #scallop #tiradito #bloodorange #rocototigersmilk #meltinthemouth #wangweioctopus #misomarinate #chancacahoney #seaweedcrisps #sweetpotatopuree #cevichewednesday,24
2017-01-17T14:54:48.000Z,kjdaisuke,SEAWEEDCRISPSw KJTOKYO,,204
2017-01-17T14:54:48.000Z,dishclover,wwww,,0
2017-01-17T14:54:48.000Z,ayumi_kura_,w w,,0
2017-01-17T14:54:48.000Z,kjdaisuke,timmykim1207w,,0
2017-01-17T14:54:48.000Z,kjdaisuke,8ayuayuminmin8w,,0
2017-01-17T14:54:48.000Z,dishclover,ww,,0
2017-01-17T14:54:48.000Z,kjdaisuke,manabuoshio official,,0
2017-01-17T14:54:48.000Z,kjdaisuke,mizukichi 67www,,0
2019-03-31T07:34:28.000Z,harrietmansell,Crisped seaweedSeaweed crispsAfter that spring equinox low tide last week I brought in a sound haul of forest kelpsugar kelp and dulseCleaneddehydrated and fried into perfectly fragilelightly crunchyumami bites that seem quite fitting here on the Jurassic coast And perfectly captured bymatt austin images,,73
2019-03-31T07:34:28.000Z,harrietmansell,seaweedseaweedcrispschefumamijurassiccoastrusticfooddinoasaurfooddevonchefbeachlifecoastalforaginglovedevonexploredevonwildfoodwildfoodlovefemalecheffoodienaturalfoodmindbodybalancechefstalksaveurmykitchentablethatsdarlingwildwomenhealthylifestylenutritiousfoodnaturallyveganplantbasedveganoutdoorslife,#seaweed #seaweedcrisps #chef #umami #jurassiccoast #rusticfood #dinoasaurfood #devonchef #beachlife #coastalforaging #lovedevon #exploredevon #wildfood #wildfoodlove #femalechef #foodie #naturalfood #mindbodybalance #chefstalk #saveur #mykitchentable #thatsdarling #wildwomen #healthylifestyle #nutritiousfood #naturallyvegan #plantbased #vegan #outdoorslife,0
2019-08-22T10:40:06.000Z,seamanchips,GOODNESS FROM THE SEA MAX TASTE The Sea Man buffet is open Today it s vegan Thursday Lower fathigher proteinmadfar dkseamanchipsveganfoodvegansnack westcoastseasaltnoplasticintheoceansseaweedcrispsalgenchipsseamanseaweedchipstangchips denmark 8500 trangtiltang,#seamanchips #veganfood #vegansnackwestcoastseasalt #noplasticintheoceans #seaweedcrisps #algenchips #seamanseaweedchips #tangchipsdenmark8500trangtiltang,26
2019-08-22T10:40:06.000Z,tangstationen,Looking very delicious,,1
2019-10-22T10:42:59.000Z,auntyesthers,Have you tried our seaweed crisps yetIf you haven tyou should seek kelpauntyestherslolstupidjokeauntyestherssaltedeggchipssgfoodsgsnackssweedseaweedcrispsmadeinaingapore,#auntyesthers #lol #stupidjoke #auntyestherssaltedeggchips #sgfood #sgsnacks #sweed #seaweedcrisps #madeinaingapore,16
2018-03-09T09:31:00.000Z,ambslara,yung ang mahal ng chip na topero super duper sa sarapseaweedchipsSeaWeedCrisps Spicy,#seaweedchips #SeaWeedCrispsSpicy,5
2020-01-30T16:13:15.000Z,celine.oenologist,Never disappoints mekwantlondon I really loved the seaweed crisps coming withHeads and Tails which got just the right amount of savory and acidity and reminded me of homeKw nt25 Heddon StMayfairLondon W1B 4BHPhoto byliimk cocktailslondonbarworlds50bestdrinkscocktailcocktailbarcocktailsofinstagrambestbarinlondonbarlondoncocktailslondonbarlondonbarbersseaweedcrispsheadsandtailscocktailevening,#londonbar #worlds50best #drinks #cocktail #cocktailbar #cocktailsofinstagram #bestbarinlondon #bar #londoncocktails #londonbar #londonbarbers #seaweedcrisps #headsandtails #cocktailevening,26
2013-03-17T02:21:04.000Z,andrewgomeziv,Roast seaweed crispsJapanese Cherry Bossom iced teaAppleseed CastLow Level Owl Vol 1 Vol2LP spinningAll tools on making a good comic strip come to life blackmoldcomicartappleseedcastvinylnerdicedteaseaweedcrispsnomz,#blackmoldcomic #art #appleseedcast #vinylnerd #icedtea #seaweedcrisps #nomz,16
2013-03-17T02:21:04.000Z,andrewgomeziv,sixsixsixes hanah it s really a tasty treatIt s nice and savory with a unique textureIt s frakkindelicious,,0
2013-03-17T02:21:04.000Z,andrewgomeziv,sixsixsixes not sure if they are a really healthy snacksBut they are better for you than chips for sureYou can find them at mostAsian markets,,0
2015-11-14T08:16:28.000Z,namakubrandku,camilanjepangngemil nya dikutabalisore ini japanesenoriseaweedcrispsoleholeh dari japan,#camilan #jepang #ngemil #kuta #bali #sore #nori #seaweedcrisps #oleholeh #japan,19
2015-11-14T08:16:28.000Z,utzutari,Bagiiii donk PakHihihi,,0
2015-11-14T08:16:28.000Z,namakubrandku,utzutari sinihhhhh,,0
2015-11-14T08:16:28.000Z,utzutari,Nanti Pak Desemberrrrr,,0
2015-11-14T08:16:28.000Z,namakubrandku,utzutari bawain cireng yang paling enak yaaaaaa,#cireng,0
2015-11-14T08:16:28.000Z,utzutari,Siaappp nanti ketemuan ya PakKangeenn,,0
2019-07-18T14:45:25.000Z,find.brazil,a vez da fruta brasileira no exteriorProdutores nacionais querem mais espa o num mercado global que jmovimenta mais de US130 bilh es por ano FindBrazilComercioExternoExportInternationalBusinessEntrepreneurbussinesscleanoceanshealthysnacksnoplasticintheoceanseaweedtrangtiltangseamanseaweedchipsseamanchipssuperfoodtangchipsseaweedcrispsgrenaaentrepreneurfirstneverfollowsexportbusinesstradetraveltransformmotivationentrepreneurmindssuccessfulmindsmindsetmentormoneymindsetmotivationfridaysuccessdiariesquotesoflife,#ComercioExterno #Export #InternationalBusiness #Entrepreneur #bussiness #cleanoceans #healthysnacks #noplasticintheocean #seaweed #trangtiltang #seamanseaweedchips #seamanchips #superfood #tangchips #seaweedcrisps #grenaa #entrepreneur #firstneverfollows #exportbusiness #tradetraveltransform #motivation #entrepreneurminds #successfulminds #mindsetmentor #moneymindset #motivationfriday #successdiaries #quotesoflife,7
2019-07-18T14:45:25.000Z,getinstagrow,find brazil,,0
2018-11-26T07:19:34.000Z,beautyeternal_,iherb16 BLACKSVM103 sejoyiasejoyiaseaweedcrisps seapointfarms 250iherb beautyeternalyesiherbfoodbrowniecrispssnack instafoodsaleiherbgoodinstadayblogfollowmelikemeseafood,#iherb #sejoyia #sejoyia #seaweedcrisps #yesiherb #food #brownie #crisps #snack #instafood #sale #iherb #good #instaday #blog #followme #likeme #seafood,84
2016-09-21T11:00:50.000Z,chi_27_kiii,seaweedcrisps korea bibigo bibigotheseaweed,#seaweedcrispskoreabibigobibigotheseaweed,3
2016-09-30T06:40:03.000Z,kulau,Prelaunchthe moment has finally arrivedyou can preorder our organic seaweed crisps now in our Onlineshop at kulau deseaweedcrispsEs ist endlich soweitihr k nnt unsere neuen Bio AlgenchipsHOT GINGERjetzt im Onlineshop vorbestellenkulau de sea veggies KULAUbioseaveggiesorganicbioalgenalgenmeeresalgenseaweedorganicseaweedtrockenalgenveganmeeresgem sealgueshealthyhealthyfoodveganfoodwakamebiowakameseaweedflakessealettuceflakesmeeressalatflockenalgenflockenalgenchipsseaweedcrispscrispsorganiccrispsbiochipsbioalgenchipsbiosnackorganicseaweedcrisps,#seaweedcrispsEs #bio #seaveggies #organic #bioalgen #algen #meeresalgen #seaweed #organicseaweed #trockenalgen #vegan #meeresgemse #algues #healthy #healthyfood #veganfood #wakame #biowakame #seaweedflakes #sealettuceflakes #meeressalatflocken #algenflocken #algenchips #seaweedcrisps #crisps #organiccrisps #biochips #bioalgenchips #biosnack #organicseaweedcrisps,32
2018-01-16T12:33:12.000Z,momofbrefre,Ini kok enak sekali yaaa seaweedcrispsseaweedkoreanfoodbrownriceseaweedbrownrice,#seaweed #koreanfood #brownriceseaweed #brownrice,11
2018-01-16T12:33:12.000Z,basrinarina,Boleh lah ci kirim2 k kita hehehhe,,0
2018-01-16T12:33:12.000Z,atalialili08,Ga percaya kalau ga dibagi,,0
2017-01-10T11:04:07.000Z,kulau,Did you already try our KULAU Seaweed CrispsThey re getting more and more popuar everydayWhat new flavour would you wish for Habt ihr schon unsere Algenchips probiertSie werden von Tag zu Tag beliebter ber welche neue Geschmacksrichtung w rdet ihr euch freuen KULAUbioorganicseaweedcrispssealettuceseaveggiesseaweedalgenchipsmeeresalgenmeeressalat,#KULAU #bio #organic #seaweedcrisps #sealettuce #seaveggies #seaweed #algenchips #meeresalgen #meeressalat,88
2017-01-10T11:04:07.000Z,lilalama_,Boah i love it,,0
2017-01-10T11:04:07.000Z,sparkling_kristin,sehr interessant,,0
2017-01-10T11:04:07.000Z,polly.pommes,Omg heaven Ich muss das wirklich unbedingt probieren,,0
2015-11-24T07:04:03.000Z,chawinnanakorn,Amuse boucheSeaweed crisps and smoked mussel mousse at The LedburyLondonOctober 2015amuseboucheseaweedcrispcrispsseaweedcrispsseaweedcrackerssmokedmusselmusselsmoussemusselmoussetastingmenufoodpornfoodiefinediningartofplatingMichelinStarMichelinStarredRestaurantWorlds50Besttheworlds50bestBrettGrahamTheLedburyNottingHillLondonEnglandUK,#amusebouche #seaweed #crisp #crisps #seaweedcrisps #seaweedcrackers #smoked #mussel #mussels #mousse #musselmousse #tastingmenu #foodporn #foodie #finedining #artofplating #MichelinStar #MichelinStarredRestaurant #Worlds50Best #BrettGraham #TheLedbury #NottingHill #London #England #UK,35
2020-04-28T14:08:28.000Z,wembleyparkmarket,Is itsnacktime yetYou can keep itguiltfree too with these yummycrunchbars fromplanetorganic which are filled with lots of healthy goodnessWe ve also added a range offlavourednuts frommrfilberts to oursnacksandtreats section online so we ve got you covered for all of yoursnacking needsfromricecrackers andseaweedcrisps tosweets chocolates fudge popcorn andbiscuits tooplanetorganicreposthealthysnacksproteinbarsvegansnacksorganicsnackssweettreatsindulgencetreatyourselfwembleyshoppingwembleydeliveryshopindependent,#snacktime #guiltfree #crunchbars #flavoured #nuts #snacksandtreats #snacking #ricecrackers #seaweedcrisps #sweets #chocolates #fudge #popcorn #biscuits #reposthealthysnacks #proteinbars #vegansnacks #organicsnacks #sweettreats #indulgence #treatyourself #wembleyshopping #wembleydelivery #shopindependent,14
2019-02-23T17:44:30.000Z,seamanchips,Sea Man is going outandreasfromkoopseamanchipsalgenchipstrangtiltangt ngnoplasticintheoceanseamanseaweedchips superfood sustainableTangchips seaweedcrispstang,#seamanchips #algenchips #trangtiltang #tng #noplasticintheocean #seamanseaweedchipssuperfoodsustainable #Tangchipsseaweedcrisps #tang,50
2019-02-23T17:44:30.000Z,mjodgard,L kkert billede,,1
2019-01-05T11:11:33.000Z,jenelletht,Nori chipsSeaweed crisps counting down till Chinese New Year allaboutfoodfoodiefoodpornfoodgasmpenangpenangkiageorgetownmalaysiaSoutheastasiatravelconnectingpeopleigersfoodguidewhattoorderthroughmyeyesiphone6schefwannablenorichipsseaweedcrispshomemadeplayingwithfirechinesenewyearseaweedcrispchips,#foodie #foodporn #foodgasm #penang #penangkia #georgetown #malaysia #Southeastasia #travel #connectingpeople #igers #foodguide #whattoorder #throughmyeyes #iphone6s #chefwannable #norichips #seaweedcrisps #homemade #playingwithfire #chinesenewyear #seaweed #crisp #chips,30
2019-01-05T11:11:33.000Z,thpnny,How much per bottle,,0
2019-01-05T11:11:33.000Z,foodiemuggles,Cool pic,,1
2018-07-08T23:12:57.000Z,threec.jp,tway bestflighttravelerjapanesegirlsimplelifehappylifealwayssmilebehappyseaweedcrispswasabi,#tway #bestflight #traveler #japanesegirl #simplelife #happylife #alwayssmile #behappy #seaweedcrisps #wasabi,55
2017-12-04T21:42:44.000Z,vinulrichgarcia,My new favorite snackkoreansnackseaweedcrispsulrich2yrs2monthsuklong,#koreansnack #seaweedcrisps #ulrich2yrs2months #uklong,7
2015-09-29T23:53:21.000Z,afya_abrafi,OMG if you love crunchy snacks like me and haven t tried this seaweed snacks outyou re totally missing outI love trying anything out once so I grabbed this single sachet of Annie Chun s Seaweed Crisps Original and some kale chips from Kroger s and I m already addictedseaweedsnacksseaweedcrispsbrownricecrispsanniechunsanniechunsseaweedsnacksseaweedsnacks,#seaweed #snacks #seaweedcrisps #brownricecrisps #anniechuns #anniechunsseaweedsnacks #seaweedsnacks,6
2015-09-29T23:53:21.000Z,isitbadforyou,Your account is AWESOME,,1
2015-09-29T23:53:21.000Z,ohmygim,Happy to see someone appreciate SEAWEEDthe future food OMG comes in 4 flavoursTry usAmazon PRIME DAY,,0
2015-07-22T00:52:09.000Z,jennaeidenier,THIS JUST MIGHT BE THE WEIRDEST THING I HAVE EVER BOUGHTseaweedseaweedsnacksseaweedchipsseaweedcrispscinnamonveganokbutwtfjenna,#seaweed #seaweedsnacks #seaweedchips #seaweedcrisps #cinnamon #vegan #okbutwtfjenna,15
2015-07-22T00:52:09.000Z,daixyhl,Are they good,,0
2015-07-22T00:52:09.000Z,jennaeidenier,lovelydaisyh I ve not tried them yetI m going to band camp at the Ohio state fair and I have to pack all of my own meals since they refuse to cater to itI intend to eat them first in front of everyone to prove my dominance as the vegan queen,,0
2015-07-22T00:52:09.000Z,daixyhl,I applaud youfor your determination is praiseworthy,,0
2019-11-10T18:23:11.000Z,jyms_exploring_world_languages,Went to Target s International Aisle and was not disappointedThis was just a small section snacksfuntrynewthingsshoppingtargetforlifeinternationalsnacksglobalcitizencolorfulseaweedcrispssomethingdifferentyum,#snacks #fun #trynewthings #shopping #targetforlife #internationalsnacks #globalcitizen #colorful #seaweedcrisps #somethingdifferent #yum,28
2019-05-02T08:59:46.000Z,x.ennn2plus5,veganveganhkseaweedcrisps,#vegan #veganhk #seaweedcrisps,21
2019-05-02T08:59:46.000Z,howsayhow,can we follow each other,,0
2018-11-03T17:51:59.000Z,analisa.ege,My new favorite snackkoreanfoodhealthyfoodcrispyyummychipsseaweedsnacksseaweedcrispsdiscoverasianfood1004gourmet1004gourmetbestsnackkoreamia0120,#koreanfood #healthyfood #crispyyummychips #seaweedsnacks #seaweedcrisps #discoverasianfood #1004gourmet #bestsnackkorea,5
2019-04-26T16:40:07.000Z,seamanchips,B L A D D E R W R A C K The superhero of the ocean The base of your three productsare made of this tasteful super organic algae High in proteinmineralsantioxidants and vitamins By all meansa true superfoodbladderwracksuperfoodorganic seaweed seamanseaweedchipsnoplasticintheoceancleanoceansseamanchips highproteinkologisk bio organicseaweed firstneverfollowslowcarbheslthysnack seaweedcrisps danish grenaa,#superfood #organicseaweedseamanseaweedchips #noplasticintheocean #cleanoceans #seamanchipshighproteinkologiskbioorganicseaweedfirstneverfollows #lowcarb #heslthysnackseaweedcrispsdanishgrenaa,172
2019-04-26T16:40:07.000Z,save_oceans_,GREAT PHOTOHelp us to grow pleaseWORLD NEEDS IT,,1
2019-04-26T16:40:07.000Z,heinemax,Yesthat s my name,,0
2019-04-26T16:40:07.000Z,tangstationen,Indover med dettak,,0
2019-04-26T16:40:07.000Z,nice_and_pure,Delicious bladderwrack,,1
2018-01-03T15:14:01.000Z,myrtleirisv,This is so goodseaweedseaweedcrispslaverbugakKfoodKoreanFoodHansiksnack,#seaweedcrisps #laver #bugak #Kfood #KoreanFood #Hansik #snack,17
2018-01-03T15:14:01.000Z,polkywalks,How does it taste,,1
2016-09-07T20:29:11.000Z,ynwafoodie,seaweedcrispstheledburycanapesfinediningtheworlds50best,#seaweedcrisps #theledbury #canapes #finedining #theworlds50best,7
2016-09-07T20:29:11.000Z,gastronogram,Looks great,,0
2016-09-07T20:29:11.000Z,ynwafoodie,gastronogram tasted great too,,0
2016-02-10T05:06:59.000Z,seaweedcrisps,popia seaweed cepat order dgn kami250g rm 1550g rm 3cod temerloh dan mentakab0111 945 0077013 979 4353popiaseaweedpopiarumpailautseaweedcrisps,#popiaseaweed #popiarumpailaut #seaweedcrisps,4
2019-04-03T12:04:32.000Z,mailecbaron,When your friend smuggles in some treats for your birthdayall the way from KoreafromankhartemisGiftbirthdaytreatsinternationalfriendshipfromkoreawithlovefromkoreatoirelandKoreakoreanfoodkimchipringleskitkatletterpresentsseaweedcrisps,#Gift #birthdaytreats #internationalfriendship #fromkoreawithlove #fromkoreatoireland #Korea #koreanfood #kimchi #pringles #kitkat #letter #presents #seaweedcrisps,20
2019-04-03T12:04:32.000Z,thejulie_jules,Elle a finalement r ussi trouver ton adresse haha trop cool,,2
2017-07-27T00:36:56.000Z,lauraslee22,Snack time seaweedcrispsonly25caloriesfor50winning,#seaweedcrisps #only25caloriesfor50 #winning,23
2017-07-27T00:36:56.000Z,annesnyderelliott,Not melol,,0
2016-10-06T09:50:43.000Z,kubosaori0326,chan seaweed crisps koreaseaweedcrisps etudehouse skinfoodthankyou,,55
2016-10-06T09:50:43.000Z,kubosaori0326,pucci n prin,,0
2015-09-18T16:58:52.000Z,aleazza5,aperitivocoreaexpothailandiathaikoreanalghealghecroccantikhaoshongnutsnocciolinenocciolinealcoccococconutsseaweedseaweedcrispsbirrabeerbirramorettimoretti,#aperitivo #corea #expo #thailandia #thai #korean #alghe #alghecroccanti #khaoshongnuts #noccioline #nocciolinealcocco #cocco #nuts #seaweed #seaweedcrisps #birra #beer #birramoretti #moretti,12
2019-04-13T00:57:27.000Z,ooh_shayla,Of you go tocostco grab me a bagAnnieChunsseaweedcrispsseasaltorganic these areamazingshaylainreallife,#costco #AnnieChuns #seaweedcrisps #seasalt #organic #amazing #shaylainreallife,6
2018-03-12T15:06:18.000Z,kazewang.eats,b b go CJ Bibigo CJ SEAWEED CRISPSBrown RiceHot Spicy Flavor84 kcal20gPrice 2 980 MMK 2 23 USD Just like it has said the flavor is spicy yet hot Since the seaweed coated with brown riceis oven baked the texture is really soft and dry Not oily at all The chip looks thin but it s not And it contained more than 15 chips Not very much calories I love it and I recommend you guys to try it Rating 8 out of 10 You can get this Seaweed crisps bag at Promart Yangon Myanmar DM me for more informations CJSeaweedcrispsbibigoseaweedcrispssnackkoreansnacksFoodkazewangeats,#CJ #Seaweedcrisps #bibigoseaweedcrisps #snack #koreansnacks #Food #kazewangeats,9
2018-03-12T15:06:18.000Z,notwenwen,Wal kyway,,1
2017-10-28T13:13:33.000Z,odin316,Korean supermarket findsNom nom nom seaweedcrispsbibigosamyangwhoooza,#bibigo #samyang,6
2017-10-28T13:13:33.000Z,poy.lim,Meron pa,,0
2019-08-10T11:27:39.000Z,amylea4104,Siap homemade popiacheese popiaseaweed seaweedcrisps snackfoodharirayahaji,#harirayahaji,12
2017-05-10T09:56:29.000Z,asampedas.sedap,HOKKAIDO SUSHIOpen Order Ready StockWasap 012 2880447 yeseaweedseaweedcrispshokkaidosushiperbadananputrajayafestivalramadhanbazaarbazaaronlinebazaarpaknilsayajualsayajualonlinesayajualkuihrayakuihrayacookiescookiesrayahomemaderecipehomemadecookiessnacksfoodiefoodstagramseaweedcrispsputrajayaramadhan2017ruangrezekihananiaseaweedsnacksadeqayrapremiumcookies,#seaweedcrisps #hokkaidosushi #perbadananputrajaya #festivalramadhan #bazaar #bazaaronline #bazaarpaknil #sayajual #sayajualonline #sayajualkuihraya #kuihraya #cookies #cookiesraya #homemaderecipe #homemadecookies #snacks #foodie #foodstagram #seaweedcrisps #putrajaya #ramadhan2017 #ruangrezekihanania #seaweedsnacks #adeqayrapremiumcookies,16
2019-07-16T14:30:32.000Z,find.brazil,Exportaes de algod o s o recorde no Brasil em 2019 FindBrazilComercioExternoExportInternationalBusinessEntrepreneurbussinesscleanoceanshealthysnacksnoplasticintheoceanseaweedtrangtiltangseamanseaweedchipsseamanchipssuperfoodtangchipsseaweedcrispsgrenaaentrepreneurfirstneverfollowsexportbusinesstradetraveltransformmotivationentrepreneurmindssuccessfulmindsmindsetmentormoneymindsetmotivationfridaysuccessdiariesquotesoflife,#ComercioExterno #Export #InternationalBusiness #Entrepreneur #bussiness #cleanoceans #healthysnacks #noplasticintheocean #seaweed #trangtiltang #seamanseaweedchips #seamanchips #superfood #tangchips #seaweedcrisps #grenaa #entrepreneur #firstneverfollows #exportbusiness #tradetraveltransform #motivation #entrepreneurminds #successfulminds #mindsetmentor #moneymindset #motivationfriday #successdiaries #quotesoflife,7
2017-04-15T10:31:24.000Z,luxecantwo,snacksseaweedcrispsfoodkoreafood,#snacks #seaweedcrisps #food #koreafood,4
2019-06-20T12:07:41.000Z,plasticchange,From Sea Man with loveThe guys inseamanchips are not only making super tasty snacksbut they support the ocean in so many ways remember them next time you are having cravings and supportouroceanseamanchipscleanoceansseaweedcrispshealthysnackssuperfoodnoplasticintheoceansseamanseaweedchips repost,#ouroceanseamanchips #cleanoceans #seaweedcrisps #healthysnacks #superfood #noplasticintheoceans #seamanseaweedchipsrepost,120
2018-09-18T14:21:09.000Z,tenko_yb,bibigo seaweed crispsbibigoseaweedcrisps,#bibigo #seaweedcrisps,36
2019-11-04T16:21:06.000Z,abakusfoods,Our Red Dates and Seaweed Crisps contain no added sugarfor all our lovely customers who are sweet enough already mondaymondaymotivationnoaddedsugarreddatejujubefruitseaweedcrispsquotenaturalvegan,#mondaymotivation #noaddedsugar #reddate #jujubefruit #seaweedcrisps #quote #natural #vegan,45
2019-11-04T16:21:06.000Z,abakusfoods,instaquotemotivationweighwatchersukslimmingworldhealthylifebalancedlifehealthysnacklowincalorieshealthysnackmotivationwholefoodsplantpoweredcleaneatinghealthychoices,#instaquote #motivation #weighwatchersuk #slimmingworld #healthylife #balancedlife #healthysnack #lowincalories #healthysnack #motivation #wholefoods #plantpowered #cleaneating #healthychoices,0
2019-11-04T16:21:06.000Z,themangledhawk,That s not trueyour hickory nuts contain sugar,,0
2017-03-22T02:19:52.000Z,veganhenning,Salad basicsaladnutritionhealthyfoodlettucetomatocucumberrainbowbabycarrotswallnutsblueberrysand those are seaweedcrisps they are seaweed on top of a brown rice chipthey are vegan plantbasedveganwhatveganseatvegetarianorganic except the chipshealthynogmos on everythingfoodpicinstafoodinstapics,#nutrition #healthyfood #lettuce #tomato #cucumber #rainbowbabycarrots #wallnuts #blueberrys #vegan #whatveganseat #vegetarian #organic #healthy #nogmos #foodpic #instafood #instapics,214
2019-07-30T22:34:13.000Z,find.brazil,Exportar para China por portos chilenos via corredor bioce nico vai gerar economia de US700 por containeraponta ministro do ItamaratyFindBrazilComercioExternoExportInternationalBusinessEntrepreneurbussinesscleanoceanshealthysnacksnoplasticintheoceanseaweedtrangtiltangseamanseaweedchipsseamanchipssuperfoodtangchipsseaweedcrispsgrenaaentrepreneurfirstneverfollowsexportbusinesstradetraveltransformmotivationentrepreneurmindssuccessfulmindsmindsetmentormoneymindsetmotivationfridaysuccessdiariesquotesoflife,#ComercioExterno #Export #InternationalBusiness #Entrepreneur #bussiness #cleanoceans #healthysnacks #noplasticintheocean #seaweed #trangtiltang #seamanseaweedchips #seamanchips #superfood #tangchips #seaweedcrisps #grenaa #entrepreneur #firstneverfollows #exportbusiness #tradetraveltransform #motivation #entrepreneurminds #successfulminds #mindsetmentor #moneymindset #motivationfriday #successdiaries #quotesoflife,4
2017-07-12T08:04:20.000Z,rico2ey,lovesweetsdessertyummydelicious dolce yumyum spicyseoulseaweedcrispsbibigo,#sweets #dessert #yummy #delicious #dolce #yumyum #spicy #seoul #seaweedcrisps #bibigo,72
2017-07-12T08:04:20.000Z,megjj6,Love,,0
2017-07-12T08:04:20.000Z,mutsumi_jj,love,,1
2017-07-12T08:04:20.000Z,jejemayutan,lovewwww wwww,,0
2017-07-12T08:04:20.000Z,naopponzu,love wpost w,,0
2017-07-12T08:04:20.000Z,jj_m_38,love,,0
2017-07-12T08:04:20.000Z,mjis12,bibigo,,0
2017-07-12T08:04:20.000Z,jae0126jae,www,,0
