date,user_id,pp_text,tag,like_point
2016-06-21T02:16:14.000Z,seapointfarms,bri healthy thank you,,0
2016-06-21T02:16:14.000Z,survivingfood,Great postThanks for taking the time to share this with us all,,0
2016-06-21T02:16:14.000Z,seapointfarms,Thanks for visitingsurvivingfood Appreciate the valuable info on your site,,0
2016-06-21T02:16:14.000Z,survivingfood,seapointfarms thank you and you are very welcome,,0
2017-01-06T11:26:42.000Z,julianebradshaw,seaweedcrispskoreansnackweirdtasteprobablyhealthy,#seaweedcrisps #koreansnack #weirdtaste #probablyhealthy,7
2017-01-06T11:26:42.000Z,julianebradshaw,petra micheli something for you to try,,0
2017-01-06T11:26:42.000Z,petra_micheli,nomnomnom MUSS ich definitiv probieren,,0
2017-01-06T11:26:42.000Z,ireland_passion,Adorable one,,0
2017-09-12T10:45:28.000Z,titipkorea,SOLDREADY STOCKPM jualbibigosnackkoreamurahsnackkoreasnackseaweedseaweedcrispsseaweedsnacksnackimportsnackimportmurahjualsnackimportjualsnackkoreahandcarrykoreatitipkoreaimportkorea,#snackkoreamurah #snackkorea #snackseaweed #seaweedcrisps #seaweedsnack #snackimport #snackimportmurah #jualsnackimport #jualsnackkorea #handcarrykorea #titipkorea #importkorea,36
2017-09-12T10:45:28.000Z,ayu.kaaa,ini berapa ka,,0
2017-09-12T10:45:28.000Z,titipkorea,ayu kaaa 51ribu yaa,,0
2018-02-14T04:34:11.000Z,kim.snacks,Homemade seaweed crisp KIMvegetarian vegan Tanpa bahan pengawetCocok untuk cemilan atau pendamping nasiRasa kriuk kriuk kresssGak coba gak tauPromo beli 5 gratis 112ks d 15 maret 2018 Yukkk diorder seaweedcrisps seaweedsnack snack,,4
2017-03-24T13:31:35.000Z,tullygirl75,bananachipsseaweedcrispsyummygoodnesslovetakingpicturespicturedoesntdoitjustice koreansnacksbestsnackseverwhat could be better then this,#bananachips #seaweedcrisps #yummygoodness #lovetakingpictures #picturedoesntdoitjustice #koreansnacks #bestsnacksever,3
2018-12-14T02:20:57.000Z,carel0803,Seaweed CrispsThe ultimate crisps that you would leave your craving endlesslyCaution addiction is warned Pre order for 2019 CNY cookies is open nowHurry up and drop me a message to ask for more details 2019 2019CNYCookies seaweedcrispscnycookies CrazyBuyingCNYCookies preordernow,#2019CNYCookiesseaweedcrispscnycookiesCrazyBuyingCNYCookiespreordernow,5
2019-07-30T06:15:20.000Z,seamanchips,Sea Man friends From last yearFiskens dag Day of the fishseamanchipsnoplasticintheoceansseaweedcrispssuperfood helthysnacks seamanseaweedchipsseaman,#Day #noplasticintheoceans #seaweedcrisps #superfoodhelthysnacksseamanseaweedchips #seaman,37
2017-11-12T02:36:28.000Z,bacchuseats,It s a nice surprise when you manage to successfully remake a recipe you winged and didn t write downramenshiitakemushroomedamamepastazucchinisoftboiledeggsseaweedcrispsavocado,#shiitakemushroom #edamamepasta #zucchini #softboiledeggs #seaweedcrisps #avocado,10
2016-07-24T13:20:08.000Z,marschapals,Our favourite snackkidslovethisseaweedcrisps,#kidslovethis #seaweedcrisps,9
2019-10-31T19:14:37.000Z,seamanchips,BREAKFAST IN GRENAASeaManSeaweedChips TrangTilTang SeaManChips SeaweedCrisps,#SeaManSeaweedChipsTrangTilTangSeaManChipsSeaweedCrisps,27
2019-10-27T07:16:52.000Z,seamanchips,Much more than a crispy seaweed snackSeaManSushi NoPlasticInTheOceans SeaManSeaweedChips TrangTilTang SeaManChips SeaweedCrisps,,36
2019-10-27T07:16:52.000Z,food2smilenl,Nice,,0
2019-12-13T14:16:35.000Z,hanh1_,Seaweed crisps to je FoodPorno czechgirlslovakiangirlseaweedcrispsasianfoodfoodporntastygamergirlvscovscocamhanhigtfolgbtlgbtq,#slovakiangirl #seaweedcrisps #asianfood #foodporn #tasty #gamergirl #vsco #vscocam #hanhi #gtfo #lgbt #lgbtq,23
2020-05-02T08:06:31.000Z,damndawndamn,Seaweedcrispsspicypumpkinsesamealmondflakessesameloveallkindshaveaniceteatime Yummyveganfoodisdelicioussuperthinnsupercrispy,#Seaweedcrisps #spicypumpkinsesame #almondflakessesame #loveallkinds #haveaniceteatime #Yummy #veganfoodisdelicious #superthinnsupercrispy,9
2018-03-19T14:37:43.000Z,kulau,We love all our seaweed crisps equallyWhich one s your favorite Wir lieben all unsere Algenchips gleich vielWelche ist deine liebste SorteAlgenKULAUseaweedseaweedcrispsAlgenchipsChipsbioorganiclecker,#KULAU #seaweed #seaweedcrisps #Algenchips #Chips #bio #organic #lecker,62
2018-03-19T14:37:43.000Z,sebastiandiesterbeck,Paprikaaaaa,,0
2018-03-19T14:37:43.000Z,startinfood.de,Ginger sieht lecker aus,,0
2019-02-19T14:28:08.000Z,seamanchips,The captains best friend Goodness from the seamax tasteandreasfromkoopnoplasticintheoceanseamanseaweedchipssustainablelobster highproteinalgenchipsseaweedcrispsseaweed cleanoceangrenaa b redygtighedseaman trangtiltangtangchips superfood,#noplasticintheocean #seamanseaweedchips #sustainable #lobsterhighprotein #algenchips #seaweedcrisps #seaweedcleanocean #grenaabredygtighed #seamantrangtiltang #tangchipssuperfood,53
2019-02-19T14:28:08.000Z,heinemax,Bladderwrack,,1
2019-02-19T14:28:08.000Z,tangstationen,Vores er squid,,1
2019-02-19T14:28:08.000Z,surfnchillonline,Hey lets collaborate send us a message when you can,,1
2020-03-09T21:54:43.000Z,they_meet_world,SNACK GAME ON POINT brownsugarbubbleteagreencolonchilicrispsseaweedcrispscrispchiliseaweedsweetbreadpandanbread,#greencolon #chilicrisps #seaweedcrisps #crispchiliseaweed #sweetbread #pandanbread,24
2019-07-12T14:30:39.000Z,find.brazil,Ap s 13 anos de hegemonia da sojaceluloserouba a cenae se consolida como principal produto de exportao de MS FindBrazilComercioExternoExportInternationalBusinessEntrepreneurbussinesscleanoceanshealthysnacksnoplasticintheoceanseaweedtrangtiltangseamanseaweedchipsseamanchipssuperfoodtangchipsseaweedcrispsgrenaaentrepreneurfirstneverfollowsexportbusinesstradetraveltransformmotivationentrepreneurmindssuccessfulmindsmindsetmentormoneymindsetmotivationfridaysuccessdiariesquotesoflife,#ComercioExterno #Export #InternationalBusiness #Entrepreneur #bussiness #cleanoceans #healthysnacks #noplasticintheocean #seaweed #trangtiltang #seamanseaweedchips #seamanchips #superfood #tangchips #seaweedcrisps #grenaa #entrepreneur #firstneverfollows #exportbusiness #tradetraveltransform #motivation #entrepreneurminds #successfulminds #mindsetmentor #moneymindset #motivationfriday #successdiaries #quotesoflife,6
2020-07-06T15:31:00.000Z,mollscanlon,Molly s seaweed drying emporiumPerfect day for this little bucket of laverbread to be sundriedI ve got some kilner jars and will be making little envelopes of flavouring to go with each lockdownpresentslockdownfunseaweedlaverbreadseaweedcrispswelshlaverbreadcrispyseaweedlockdownchefwelshmanscaviar,#lockdownpresents #lockdownfun #seaweed #laverbread #seaweedcrisps #welshlaverbread #crispyseaweed #lockdownchef #welshmanscaviar,8
2016-06-06T23:36:40.000Z,randomramblinghan,Teainvolved a sweet potato with Biscoff spread I might need to send my phone off for a new battery it loses charge SO quickly and it drives me MADfoodfoodiehealthyhealthyfoodgoodfatvegetarianvegetarianfoodproteincarbshoumousMoroccanhoumousseaweedcrispsolivespeanutbuttercinnamonsweetpotatoBiscoffspreadtofuGrafittitofucolourfulmealeattherainbowedfamfitfamfoodisfuelenergysaladstrongnotskinnyactivelifestylefirstworldproblems,#food #foodie #healthy #healthyfood #goodfat #vegetarian #vegetarianfood #protein #carbs #houmous #Moroccanhoumous #seaweedcrisps #olives #peanutbutter #cinnamon #sweetpotato #Biscoffspread #tofu #Grafittitofu #colourfulmeal #eattherainbow #edfam #fitfam #foodisfuel #energy #salad #strongnotskinny #activelifestyle #firstworldproblems,32
2020-05-26T00:50:46.000Z,pitaeats,Reminds me of Fish Food Watch full video on my YouTube channellink in bioThank you for watchingmake sure to likecomment and share this video with family and friendsJoin the Posse and Follow this channelMuch Ofa s pitaeatspitachewpitapossetonganfoodofthedayfoodbloggerfoodiemukbangerssatisfyingvideosfoodlifefoodcomafoodiegrammukbangmukbangasmrmukbangvideomukbangshowasmrtistasmreatingshoweathealthyeatyourveggieseatplantseatsmarteatwelllivewelleatmoreplantseatveggieseatveganeatinghealthyseaweedchipsseaweedcrispsfishfood,#pitachew #pitaposse #tongan #foodoftheday #foodblogger #foodie #mukbangers #satisfyingvideos #foodlife #foodcoma #foodiegram #mukbang #mukbangasmr #mukbangvideo #mukbangshow #asmrtist #asmreatingshow #eathealthy #eatyourveggies #eatplants #eatsmart #eatwelllivewell #eatmoreplants #eatveggies #eatvegan #eatinghealthy #seaweedchips #seaweedcrisps #fishfood,33
2020-05-26T00:50:46.000Z,dinah1053,Reminds me of kale cooked in the oven on a sheet panPut olive oilsaltpepper and bakeThen serve with or without dipsVery unexpectedly deliciousTry it,,0
2018-06-25T20:55:18.000Z,underhillscrossing,tuna tartareavocadosoymirinseaweedcrispsspicyyuzyvinaigrettewestchesternyeatswestchestereatslohudfoodwestchestermagazinenytimesfoodrestaurantlifetastingmenuhospitalityeatlocalfarmfreshBronxvilleinstagoodinstadailyfoodbestofthedayrestaurantslocalfoodinstacoolSLCconcordiany,#avocado #soymirin #seaweedcrisps #spicyyuzyvinaigrette #westchesternyeats #westchestereats #lohudfood #westchestermagazine #nytimesfood #restaurantlife #tastingmenu #hospitality #eatlocal #farmfresh #Bronxville #instagood #instadaily #food #bestoftheday #restaurants #localfood #instacool #SLC #concordiany,54
2018-06-25T20:55:18.000Z,j.oliveradvertising,looks,,0
2018-06-08T15:46:58.000Z,xigdn316,korea almond seaweedcrisps yogurtjellyhairessence skinfood arganoil,,33
2019-09-21T07:22:59.000Z,seamanchips,SATURDAY SEAWEEDgrandsvinveganseaweedChips WestCoastSeaSalt seamanseaweedchipsnoplasticintheoceansseamanchipstrangtiltangseaweedcrisps,#veganseaweedChipsWestCoastSeaSaltseamanseaweedchips #noplasticintheoceans #seamanchips #trangtiltang #seaweedcrisps,39
2019-09-21T07:22:59.000Z,zeniri,Are these in supermarkets in Odense,,0
2017-12-04T12:08:55.000Z,kumarincoco,seaweedcrisps masksheet,#masksheet,86
2019-10-21T08:41:03.000Z,seamanchips,Young ambitious kidswith eyes for qualitySea Man approves Susan L vstad Holdt SeaManSeaweedChips SeaManChips NoPlasticInTheOceans SeaweedCrisps TrangTilTang,,31
2015-05-23T11:57:44.000Z,sastasnacks,weekendseasunsastasnacksseaweedcrisps,#weekend #sea #sun #sastasnacks #seaweedcrisps,16
2015-05-23T11:57:44.000Z,pacrunch.restaurant,Awesome restaurantI m sure that anyone who comes across your food would say the sameWe ve helped hundreds of restaurants grow their business with our serviceand I would love to show you our value through a free trial,,0
2018-12-26T22:01:44.000Z,y.u.k.0.3.1.2,vaseline Vaselineoreobibigo seaweedcrisps cnp,#Vaseline #oreo #bibigoseaweedcrisps #cnp,81
2018-05-23T05:27:46.000Z,jastipjakbar_keroholicshopp,Seaweed CrispsRumput LautKoreaRasa BBQIDR 30 000Yuck Followsnackexport bykennedy Ready Langsung Kirimseeweedseaweedseaweedkoreaseaweedcrispsrumputlautrumputlautkorearumputlautkoreamurah,#seaweed #seaweedkorea #seaweedcrisps #rumputlaut #rumputlautkorea #rumputlautkoreamurah,6
2017-02-22T12:23:58.000Z,kpopminnn,Seaweed Crisps1Honey Corn seaweedcrispsbrownriceovenbakedhoneyandcornflavhealthierchoicenewflavnevertriedbeforeboughtthis3mthsagohahaha imknownforlatepost,#brownrice #ovenbaked #honeyandcornflav #healthierchoice #newflav #nevertriedbefore #boughtthis3mthsago #hahaha #imknownforlatepost,5
2016-08-03T12:44:57.000Z,the_som_korea,Korea seaweed snacksThe SOM Korea website www facebook com thesomkorBEAUTYlink https goo gl 4YpkNk FASHIONlink https goo gl NMjslZ Starbuckslink https goo gl F7k0bs OTHERSlink https goo gl cwYjKt korea kr seoul agency kragency lifestyle krlifestyle fashion beauty skincare makeup sweet seaweed biscuits seaweedcrisps seaweedbiscuits snacks limitededition wholesale worldwide,,15
2016-08-03T12:44:57.000Z,newportskinclinic,Too nice,,0
2016-08-03T12:44:57.000Z,the_som_korea,newportskinclinic Really yummy fashion jump store,,0
2015-03-16T06:09:44.000Z,sakilabdulkhalid,Jom serbuministryofshopaholic hari nih boleh rembatseaweedcrisps rm11 je sebalangjom ramai2 serbuministryofshopaholicbazarpaknilbazaronlineinstashopputrajayapresint11precint15presint14upmunitencyberjayasayajualmurahsayajualvendorputrajayaseaweedcrispsseaweedcrunchyofflineshop,#seaweedcrisps #bazaronline #instashop #putrajaya #presint11 #precint15 #presint14 #upm #uniten #cyberjaya #sayajualmurah #sayajual #vendorputrajaya #seaweedcrisps #seaweedcrunchy #offlineshop,7
2015-03-16T06:09:44.000Z,ciksalmahjualshaklee,I love this image,,0
2015-03-16T06:09:44.000Z,jazafaeza,WowI like your picture,,0
2015-03-16T06:09:44.000Z,kedaibungadelivery,Jom tambah follower instagram andafollowmalaysiainstadotcom,,0
2019-06-23T13:03:24.000Z,forhistoriskmad,Masser af gode madoplevelser pBornholmIg r var jeg til madmarked og smagte blatang chips og ramsl gs mayoDerefter en tur pMelstedg rdhvor jeg l rte hvordan man runker sennep med en kanonkugle og kiggede pgamle m lke redskaberbornholmvildmadwildfoodramsl gramsonseaweedcrispstangchipssennepmustardkanonkuglecannonballrunkesennepmelstedgaardhistoriskmadhistoricfoodfoodieforhistoriskmadprehistoricfood,#bornholm #vildmad #wildfood #ramslg #ramson #seaweedcrisps #tangchips #sennep #mustard #kanonkugle #cannonball #runkesennep #melstedgaard #historiskmad #historicfood #foodie #forhistoriskmad #prehistoricfood,28
2019-06-23T13:03:24.000Z,flabbergastedfirefly,Uhm hvor ser det bare godt,,1
2019-06-23T13:03:24.000Z,forhistoriskmad,flabbergastedfirefly Det var ogsgodtOg den h ndlavedeeller benlavederunkede sennep smager ivrigt virkelig godt,,0
2016-10-14T08:22:14.000Z,seapointfarms,We are feelingfestive at the farm thisfridayautumnpumpkinpatchpumpkinshealthysnacksseaweedcrispsedamamedryroastededamameorganicedamamepastaamazonprimeveganlifestyleamazon,#festive #friday #autumn #pumpkinpatch #pumpkins #healthysnacks #seaweedcrisps #edamame #dryroastededamame #organicedamamepasta #amazonprime #vegan #lifestyle #amazon,88
2018-11-19T17:58:37.000Z,menon_mina,Whenthe girl next door diaries went for a holiday tothailand I shamelessly insisted that she brings me back a giftShe got me back a little little hamper but my favorite has to be theseseaweedcrispsIt isearthy and is bursting withtasteofsea all getsfrom me A friend like this is a keeper rightPSbrownie points if you guys can tell me if i can source these online,#thailand #seaweedcrisps #earthy #tasteofsea,9
2018-11-19T17:58:37.000Z,hema_anavatti,what else is in the hamper,,0
2018-11-19T17:58:37.000Z,the_girl_next_door_diaries,Awww,,0
2018-11-19T17:58:37.000Z,the_girl_next_door_diaries,Available onlineJust checkedOnly costs the worth of an arm and a leg,,0
2016-05-11T13:39:40.000Z,mika_saka,seaweedcrispsseeweedbibigokoreansnack,#seaweedcrisps #seeweed #bibigo #koreansnack,168
2016-05-11T13:39:40.000Z,jedi0565,It looks tastyI want to eat,,0
2019-07-27T09:28:23.000Z,heinemax,Holland er mit nye yndlings land og helt specifikt Katwijk Surf Club Til september skal Mads Emil og jeg skabe tang magisammen med en masse sp ndene og dygtige mennesker Jeg har i 6r v ret besat af tang og missionen med at fgjort det sexetsdet ikke kun er helsekost og heksedoktorersom anvender det F ler jeg er n et langtmen er ikke i m l Der er kommer stadig flere og flere firmaer og personer som vil arbejde med tanghvilket er pisse fedtJeg har selv lavet tvtangkogebogworkshops og popup restaurantalt sammen for at s tte fokus phavets miljrigtige gr ntsag Til efter ret kommer der ny boglidt tv og en masse larm om tangen N r jeg bliver inviteret til s dan et stort setupsom denne festival ersbliver jeg oprigtigt glad og stoltstak Arie og Marco Hvis du er i n rheden eller har brug for en over den kulinariskeopleversskynd dig at book en billetdet er svanvittig inspirerede og dygtige mennesker du kan opleve i surf klubben Jeg har indg et en aftale medgroovygraphic Som kommer til at lave en film omkring turen der nedden kommer pyoutube kanalen til efter retKW106katwijksebrandingsurfclubseamanseaweedchipsnoplasticintheoceansseaweedcrispstrangtiltang algenchips futurefoods tangchips superfood healthysnacks,#katwijksebrandingsurfclub #seamanseaweedchips #noplasticintheoceans #seaweedcrisps #trangtiltangalgenchipsfuturefoodstangchipssuperfoodhealthysnacks,38
2019-07-27T09:28:23.000Z,tangstationen,Du er svild Max,,2
2019-07-27T09:28:23.000Z,seaflavours.nl,This will be greatMake seaweed big,,1
2019-07-27T09:28:23.000Z,groovygraphic,Det bliver en forn jelse at arbejde sammen med digheinemax,,1
2019-07-27T09:28:23.000Z,heinemax,evelineoehlen hope to SEA ya herr,,1
2019-02-26T10:11:33.000Z,foragefrolics,BRINGING OUT THE SEA SPAGHETTIthat I harvested last summerDelicious and crunchy it could be eaten as is like seaweed crispsSea spaghetti cooks up just like pasta especially if it is harvested young and it is great for grain free low carbohydrate meals as a bulk ingredient as you would use spaghetti pastaIt makes delicious carbonaras amongst other thingsSimply rehydrate and use fresh on salads or boil as you would pastaSea spaghetti like its name suggests tastes more like pasta than it does seaweedgrainfreepaleoprimallowcarbnopastaseaspaghettiseaweedglutenfreewildfoodlovethewildseaweedcrispsketodiet,#paleo #primal #lowcarb #nopasta #seaspaghetti #seaweed #glutenfree #wildfood #lovethewild #seaweedcrisps #ketodiet,38
2019-02-26T10:11:33.000Z,originaltin,Cool,,1
2016-04-26T02:06:39.000Z,california___dreamer,Perfect gloomy weather activity sitting by the fireplace playing video games and eating snacks,,22
2016-04-26T02:06:39.000Z,california___dreamer,gloomyweathergloomyweatherstayinsidestaycationwarminsidehousehomefireplacefirevideogamesfinalfantasyfinalfantasycrystalchroniclesfirewoodsnackshomebodytvseaweedseaweedcrispsseaweedsnackvegetariansodasandwichhealthy,#gloomy #weather #gloomyweather #stayinside #staycation #warm #inside #house #home #fireplace #fire #videogames #finalfantasy #finalfantasycrystalchronicles #firewood #snacks #homebody #tv #seaweed #seaweedcrisps #seaweedsnack #vegetarian #soda #sandwich #healthy,0
2016-04-26T02:06:39.000Z,california___dreamer,bookbookstruelove,#book #books #truelove,0
2016-04-26T02:06:39.000Z,epiersonproductions,Neato,,0
2016-10-13T19:24:47.000Z,everydaylife_nutrition_balance,Didn t have a chance this am to make myGolden Milk so I got this deliciousnessrebbl turmeric golden milksproutsand a few other wonderful essentials that I needed plus a few extras gaiaherbsgtskombuchabonafidepurely elizabethanniechunsincbonebrothseaweedcrispsroastedseaweedpurelyelizabethpumpkingranolagingeradekombuchabananaastragalusrootgoldenmilktumericsweetpotatochickpeassquashyumminesstiuaztiu31,#bonebroth #seaweedcrisps #roastedseaweed #purelyelizabethpumpkingranola #gingeradekombucha #banana #astragalusroot #goldenmilk #tumeric #sweetpotato #chickpeas #squash #yumminess #tiuaz #tiu31,92
2016-10-13T19:24:47.000Z,holinatural,super cool,,0
2016-10-13T19:24:47.000Z,brigeeski,Really Nice,,0
2016-10-13T19:24:47.000Z,sweetdigsca,Love it,,0
2016-10-13T19:24:47.000Z,blessedparentsof4,Like it,,0
2016-10-13T19:24:47.000Z,carolynabauer,Fab,,0
2018-01-27T12:48:40.000Z,janyonce,calissnack650 kcal 6calissnackseaweedseaweedcrispsalmondssesameseaweedsnackhealthysnackhealthysnackglutenfreecholesterolfreenotransfatnomsg,#seaweed #seaweedcrisps #almonds #sesame #seaweedsnack #healthy #snack #healthysnack #glutenfree #cholesterolfree #notransfat #nomsg,93
2017-12-27T13:40:30.000Z,qaqqwqq3q,123 4 5 15 1 50 4Whatsapp 69704272hksnackssnacksshoptrymehkeatereatmegirlsseaweedcrisps,#hksnacks #snacksshop #tryme #hkeater #eatmegirls #seaweedcrisps,5
2017-12-27T13:40:30.000Z,notemac,Cool photo,,0
2019-08-06T08:59:11.000Z,sako.dn_nbv,bibigoseaweedcrisps almondbutter100,#bibigo #seaweedcrisps #almondbutter #100,16
2019-04-10T20:32:58.000Z,seamanchips,MR SEA MAN receiving a honorary diploma fromThe Danish Gastronomic Academy for the work with seaweed and the seaweed chips The seaweed business is one of the most interesting and fast growing These years and it s a honor to be a part of it We work hard everyday to make a difference We have high expectations to our self and want to become the most sustainable Food brand in the worldSome of the goals for 2019 is 100Plastic free100organic and we want to make the healthiest and tasteful snack in the worlddavidberingnoplasticintheoceanseamanchipsfirstneverfollowstangchipsseaweedcrispsalgenk nighighproteinsuperfood sustainabilitytrangtiltang,#noplasticintheocean #seamanchips #firstneverfollows #tangchips #seaweedcrisps #algenknig #highprotein #superfoodsustainability #trangtiltang,121
2017-07-29T09:46:55.000Z,fheltagavilla,Why be sad when there s extra pearls Perfect snack combinationchatimephmilkteahappyfindsseaweedcrispsthehappynowlifesimplejoysoutandabout,#milktea #happyfinds #seaweedcrisps #thehappynow #lifesimplejoys #outandabout,20
2020-06-01T11:01:25.000Z,what_flo_eats,Little delivery ofclearspringukSeaveg Crispies with a lovely free surprise inside and also a cheeky little cuppa Thank you so much seavegcrispiesclearspringukveganfindsveganveganuary2020veganeatswhatveganseatplantbasedfoodveganstuffseaweedcrispsseaweedsnackshojicajapanesetea,#seavegcrispies #clearspringuk #veganfinds #vegan #veganuary2020 #veganeats #whatveganseat #plantbasedfood #veganstuff #seaweedcrisps #seaweedsnacks #hojica #japanesetea,122
2020-06-01T11:01:25.000Z,wilsongareth,Hi your post are pretty much really healthy foods and drinksDo you feel the benefit of eating this way I m genuinely interested as I m thinking I need to make a fair few changes myself,,1
2020-06-01T11:01:25.000Z,wilsongareth,Thanks,,1
2020-06-01T11:01:25.000Z,r.x._queen,Omg yummm,,1
2016-11-16T22:29:26.000Z,snack.fever,SnackFever s nerdy but talented designers JoshJTand SarahAnnieChunsSnackFeverSeaweedCrispsKoreanSnacks,#SnackFever #SeaweedCrisps #KoreanSnacks,420
2016-11-16T22:29:26.000Z,hallyualyssa,Sarah is so pretty,,0
2016-11-16T22:29:26.000Z,kpopkatey,hallyualyssa omg yes she is,,0
2016-11-16T22:29:26.000Z,phyu.n,I m early,,0
2016-11-16T22:29:26.000Z,justthatsailormoongirl,Gorgeous people right there,,0
2016-11-16T22:29:26.000Z,sra.hsni,TNx for like me,,0
2019-09-07T08:25:47.000Z,seamanchips,Squid pepper Saturdayseaflavours nlseamanchipsnoplasticintheoceansseamanseaweedchipsseaweedcrispstrangtiltang,#seamanchips #noplasticintheoceans #seamanseaweedchips #seaweedcrisps #trangtiltang,35
2019-09-07T08:25:47.000Z,seaflavours.nl,Have fun at thefoodfestivalofficial,,0
2017-09-13T04:43:13.000Z,titipkorea,SOLDBIBIGO SEAWEED CRISPS LINE MQL2523F jualbibigosnackkoreamurahsnackkoreasnackseaweedseaweedcrispsseaweedsnacksnackimportsnackimportmurahjualsnackimportjualsnackkoreahandcarrykoreatitipkoreaimportkorea,#snackkoreamurah #snackkorea #snackseaweed #seaweedcrisps #seaweedsnack #snackimport #snackimportmurah #jualsnackimport #jualsnackkorea #handcarrykorea #titipkorea #importkorea,30
2019-05-07T01:22:14.000Z,tubbyherbivore,Munchies Seaweed Crispsseapointfarmsseaweedcrispsalmondsesamepumpkinsesamenongmoglutenfreegovegan munchiesvegansnacksveganveganismveganlifestyleveggieliciousveganfriendlyplantbasedwhatveganeatsinstafoodie,#seaweedcrisps #almondsesame #pumpkinsesame #nongmo #glutenfree #govegan #munchies #vegansnacks #vegan #veganism #veganlifestyle #veggielicious #veganfriendly #plantbased #whatveganeats #instafoodie,22
2018-02-27T15:35:18.000Z,seapointfarms,E n j o y your TuesdayFriends paleolistic Diving into these likeY allKelp meThese are sooo good did you get that subtle jokeback thereI m not even going to lieI ate the whole bag in one sittingThey re not tooseaweed yif that s not your jamI know it might soundthat a snack made of seaweed could be tastybut trust p sif these come in ranch flavorGameOverpaleoeeeeeatspaleosnackketokelpseafoodseefoodhealthysnackseaweed,#eeeeeats #paleosnack #keto #kelp #seafood #seefood #healthysnack #seaweed,198
2018-02-27T15:35:18.000Z,seapointfarms,tuesdaytransformationtuesdayweightlossjourneyweightlossnongmoglutenfreeseaweedseaweedcrispshealthysnackhealthylivingnourishhealthylifestyleyogarunningpilateslifestyleenjoylifeeatwelllove,#tuesday #transformationtuesday #weightlossjourney #weightloss #nongmo #glutenfree #seaweed #seaweedcrisps #healthysnack #healthyliving #nourish #healthylifestyle #yoga #running #pilates #lifestyle #enjoylife #eatwell #love,0
2018-02-27T15:35:18.000Z,paleolistic,submerged in deliciousness,,0
2018-02-27T15:35:18.000Z,plantpowered_sophie,Sounds amazingWhere do you get your seaweed from,,0
2019-11-21T17:45:01.000Z,marieprettylittlepsycho,I really love hot and spicy seaweed crispsseaweedcrispsbibigocheiljedangbrownricekoreanfoodhotandspicyyummyfoodpornerstmalzupennymalkavianmadnessmadgirlmarieaugureyscamanderprettylittlepsychoelfenkindcrybabykidult,#bibigo #cheiljedang #brownrice #koreanfood #hotandspicy #yummy #foodporn #erstmalzupenny #malkavian #madness #madgirl #marieaugureyscamander #prettylittlepsycho #elfenkind #crybaby #kidult,10
2019-11-21T17:45:01.000Z,shizuma_s11,Und sie sind wirklich scharf,,1
2019-06-01T11:25:50.000Z,seamanchips,STOP PLASTIC POLLUTION SEA MAN CHIPSHJEMHAVNSUPERSTAINABLEPLASTIC CHANGE against plastic abuses Captain Salazar hjemhavnplasticchangeseamanchipsseamanseaweedchipsnoplasticintheoceansdenmarkseaweedcrispsseaweedb redygtighedenshusgrenaa cleanoceanssuperfood,#plasticchange #seamanchips #seamanseaweedchips #noplasticintheoceans #denmark #seaweedcrisps #seaweed #bredygtighedenshus #grenaacleanoceans #superfood,212
2019-06-01T11:25:50.000Z,mikkelbechs,Boys,,1
2019-06-01T11:25:50.000Z,koreanseaweed,We shared your postThank you so proud,,1
2019-06-01T11:25:50.000Z,oopwrongway111,Just perfect,,0
2019-06-01T11:25:50.000Z,sandri.kosta,WellU r having a lot of FUUUUNNN,,0
2019-06-01T11:25:50.000Z,hcv47,Never lose your awesomeness,,0
2019-06-01T11:25:50.000Z,nora_colombia,Y los otros como son Y cuan largo son Linda foto,,0
2019-06-01T11:25:50.000Z,laama_abaya,Smart boy I mean it,,0
2019-06-01T11:25:50.000Z,bodaheshamm,plz share more,,0
2019-06-01T11:25:50.000Z,0cul0ry,Yesthat s the truth,,0
2019-06-01T11:25:50.000Z,ryleaaaa.b,I like it,,0
2019-06-01T11:25:50.000Z,greciadelapaz,Hey So sweet muahhh,,1
